"Status","Start Time","Stop Time","Duration in ms","Parent Suite","Suite","Sub Suite","Test Class","Test Method","Name","Description"
"passed","Fri Sep 10 10:48:16 UTC 2021","Fri Sep 10 10:48:20 UTC 2021","3800","","cancel account feature","","cancel account feature","cancel account","cancel account",""
"passed","Fri Sep 10 10:48:13 UTC 2021","Fri Sep 10 10:48:13 UTC 2021","20","","cancel account feature","","cancel account feature","check for redirecting to the payment page","check for redirecting to the payment page",""
"passed","Fri Sep 10 10:48:09 UTC 2021","Fri Sep 10 10:48:13 UTC 2021","3664","","cancel account feature","","cancel account feature","set value and click ""get traffic"" button","set value and click ""get traffic"" button",""
"passed","Fri Sep 10 10:48:20 UTC 2021","Fri Sep 10 10:48:20 UTC 2021","54","","cancel account feature","","cancel account feature","should redirect to home page","should redirect to home page",""
"passed","Fri Sep 10 10:48:04 UTC 2021","Fri Sep 10 10:48:09 UTC 2021","5242","","cancel account feature","","cancel account feature","sign in with valid credentials","sign in with valid credentials",""
"passed","Fri Sep 10 10:48:01 UTC 2021","Fri Sep 10 10:48:04 UTC 2021","3214","","cancel account feature","","cancel account feature","click ""free account"" button","click ""free account"" button",""
"passed","Fri Sep 10 10:48:13 UTC 2021","Fri Sep 10 10:48:16 UTC 2021","2929","","cancel account feature","","cancel account feature","go to account setting page","go to account setting page",""
