"Status","Start Time","Stop Time","Duration in ms","Parent Suite","Suite","Sub Suite","Test Class","Test Method","Name","Description"
"passed","Sun Sep 19 04:53:19 UTC 2021","Sun Sep 19 04:53:22 UTC 2021","3083","","cancel account feature","","cancel account feature","cancel account","cancel account",""
"passed","Sun Sep 19 04:53:12 UTC 2021","Sun Sep 19 04:53:16 UTC 2021","4127","","cancel account feature","","cancel account feature","set value and click ""get traffic"" button","set value and click ""get traffic"" button",""
"passed","Sun Sep 19 04:53:04 UTC 2021","Sun Sep 19 04:53:07 UTC 2021","2942","","cancel account feature","","cancel account feature","click ""free account"" button","click ""free account"" button",""
"passed","Sun Sep 19 04:53:16 UTC 2021","Sun Sep 19 04:53:19 UTC 2021","2883","","cancel account feature","","cancel account feature","go to account setting page","go to account setting page",""
"passed","Sun Sep 19 04:53:07 UTC 2021","Sun Sep 19 04:53:12 UTC 2021","4765","","cancel account feature","","cancel account feature","sign in with valid credentials","sign in with valid credentials",""
"passed","Sun Sep 19 04:53:22 UTC 2021","Sun Sep 19 04:53:22 UTC 2021","12","","cancel account feature","","cancel account feature","should redirect to home page","should redirect to home page",""
"passed","Sun Sep 19 04:53:16 UTC 2021","Sun Sep 19 04:53:16 UTC 2021","18","","cancel account feature","","cancel account feature","check for redirecting to the payment page","check for redirecting to the payment page",""
